{
  "$schema": "./schemas/state.schema.json",
  "schema_version": "0.1",
  "project": "onseki",
  "loop_status": "IDLE",
  "product_phase": "IMPLEMENTATION",
  "active_goal_id": "goal-realtime-arrangement-map",
  "active_gap_id": null,
  "active_attempt_id": null,
  "write_lock": null,
  "last_verified_version": "38d71a2",
  "health": {
    "build": "PASS",
    "player_sync": "PASS",
    "mix_controls": "PASS",
    "accessibility": "PASS"
  },
  "counters": {
    "verified_transitions": 8,
    "rejected_hypotheses": 0,
    "human_decisions_pending": 0
  },
  "last_transition": {
    "from": "VALIDATING",
    "to": "IDLE",
    "reason": "Status card no longer shows resolved human decisions as active",
    "run_id": "run-20260724-status-card-resolved-decision"
  },
  "updated_at": "2026-07-24T12:57:43Z"
}
